post_id_tech,formatted_post_title,formatted_timestamps,post_link,keyword
18s2jjn,Molecular jackhammers’ ‘good vibrations’ eradicate cancer cells. Light-induced whole-molecule vibration can rupture melanoma cells’ membrane.,2024-01-04T11:56:05.807000+0000,https://www.reddit.com/r/tech/comments/18s2jjn/molecular_jackhammers_good_vibrations_eradicate/,"['molecular jackhammers ’ ‘ good vibrations ’ eradicate cancer cells', 'rupture melanoma cells ’ membrane', 'molecule vibration', 'induced whole', 'light']"
18racr6,"New Photonic Chip Is the Full Package. For the first time, researchers place a photonic filter and modulator on a standard chip.",2024-01-03T17:08:11.179000+0000,https://www.reddit.com/r/tech/comments/18racr6/new_photonic_chip_is_the_full_package_for_the/,"['new photonic chip', 'standard chip', 'photonic filter', 'researchers place', 'full package', 'first time', 'modulator']"
18qmwme,Magnetic Knots Push Future Computing Toward 3D. Twisted structures called hopfions are easy to move but hard to destroy,2024-01-03T16:51:28.590000+0000,https://www.reddit.com/r/tech/comments/18qmwme/magnetic_knots_push_future_computing_toward_3d/,"['magnetic knots push future computing toward 3d', 'twisted structures called hopfions', 'move', 'hard', 'easy', 'destroy']"
18q623w,"Wireless TVs use built-in cameras, NFC readers to sell you stuff you see on TV. TV makers are getting more aggressive about using their hardware for ads.",2024-01-02T20:04:01.735000+0000,https://www.reddit.com/r/tech/comments/18q623w/wireless_tvs_use_builtin_cameras_nfc_readers_to/,"['wireless tvs use built', 'nfc readers', 'tv makers', 'tv', 'using', 'stuff', 'sell', 'see', 'hardware', 'getting', 'cameras', 'aggressive', 'ads']"
18p6140,This vibrating pill could trick your stomach into feeling full | The pill stimulates the nerve endings in the stomach and alters the hormones related to hunger and satiety.,2024-01-02T01:25:30.979000+0000,https://www.reddit.com/r/tech/comments/18p6140/this_vibrating_pill_could_trick_your_stomach_into/,"['vibrating pill could trick', 'pill stimulates', 'nerve endings', 'hormones related', 'feeling full', 'stomach', 'stomach', 'satiety', 'hunger', 'alters']"
18pen3n,IBM demonstrates a nanosheet transistor that can withstand boiling nitrogen | IBM's concept nanosheet transistor could eventually lead to the development of a new class of chip,2024-01-01T16:07:57.357000+0000,https://www.reddit.com/r/tech/comments/18pen3n/ibm_demonstrates_a_nanosheet_transistor_that_can/,"['concept nanosheet transistor could eventually lead', 'withstand boiling nitrogen', 'nanosheet transistor', 'new class', 'ibm demonstrates', 'ibm', 'development', 'chip']"
18ocvbj,"Scientists create water-spitting 'flying dragon' robot to fight fires | The robot features eight adjustable water jets in its central and head regions, with a flexible firehose directed by a control unit on a trailing wheeled cart.",2023-12-30T15:19:13.647000+0000,https://www.reddit.com/r/tech/comments/18ocvbj/scientists_create_waterspitting_flying_dragon/,"['robot features eight adjustable water jets', 'scientists create water', 'trailing wheeled cart', 'flexible firehose directed', 'head regions', 'flying dragon', 'fight fires', 'control unit', 'robot', 'spitting', 'central']"
18odaru,Head zaps help surgeons transfer skills from VR to IRL,2023-12-29T16:26:38.502000+0000,https://www.reddit.com/r/tech/comments/18odaru/head_zaps_help_surgeons_transfer_skills_from_vr/,"['head zaps help surgeons transfer skills', 'vr', 'irl']"
18ntq3h,IBM Demos Transistor with Liquid Nitrogen Cooling,2023-12-08T16:33:13.457000+0000,https://www.reddit.com/r/tech/comments/18ntq3h/ibm_demos_transistor_with_liquid_nitrogen_cooling/,"['liquid nitrogen cooling', 'ibm demos transistor']"
18nj5q2,New nuclear deflection simulations advance planetary defense against asteroid threats,2023-12-29T13:02:56.978000+0000,https://www.reddit.com/r/tech/comments/18nj5q2/new_nuclear_deflection_simulations_advance/,"['new nuclear deflection simulations advance planetary defense', 'asteroid threats']"
18nafpc,"Clot-busting ""millirobots"" corkscrew their way through blood vessels",2023-12-28T21:26:53.903000+0000,https://www.reddit.com/r/tech/comments/18nafpc/clotbusting_millirobots_corkscrew_their_way/,"['blood vessels', 'way', 'millirobots', 'corkscrew', 'clot', 'busting']"
18mwlxt,"The Surprising Possibilities of See-Through Wood | Stronger than plastic and tougher than glass, the resin-filled material is being exploited for smartphone screens, insulated windows and more",2023-12-29T01:33:13.141000+0000,https://www.reddit.com/r/tech/comments/18mwlxt/the_surprising_possibilities_of_seethrough_wood/,"['surprising possibilities', 'smartphone screens', 'insulated windows', 'filled material', 'wood', 'tougher', 'stronger', 'see', 'resin', 'plastic', 'glass', 'exploited']"
18muhqw,Tech Gives Sound Directionality to Hearing Aids. System identifies faces and links them to speech.,2023-12-28T11:54:47.761000+0000,https://www.reddit.com/r/tech/comments/18muhqw/tech_gives_sound_directionality_to_hearing_aids/,"['tech gives sound directionality', 'system identifies faces', 'hearing aids', 'speech', 'links']"
18miwhl,"Quantum-inspired tech teleports data with light, like 'Star Trek' | “Now, it is possible to teleport information so that it never physically travels across the connection - a “Star Trek” technology made real,"" said researcher.",2023-12-28T15:55:01.208000+0000,https://www.reddit.com/r/tech/comments/18miwhl/quantuminspired_tech_teleports_data_with_light/,"['“ star trek ” technology made real ,"" said researcher', 'never physically travels across', 'inspired tech teleports data', 'star trek', '“', 'teleport information', 'quantum', 'possible', 'like', 'light', 'connection']"
18mjyjo,Smart lasers for bone surgery. A feedback mechanism distinguishes between hard and soft tissue when cutting through bones.,2023-12-27T16:30:32.950000+0000,https://www.reddit.com/r/tech/comments/18mjyjo/smart_lasers_for_bone_surgery_a_feedback/,"['feedback mechanism distinguishes', 'soft tissue', 'smart lasers', 'bone surgery', 'hard', 'cutting', 'bones']"
18lzz65,"World’s largest electric cable close to power, could light 1.4 million homes | A high voltage direct current cable will connect UK homes with fresh green energy from the wind farms of Denmark.",2023-12-27T14:57:43.213000+0000,https://www.reddit.com/r/tech/comments/18lzz65/worlds_largest_electric_cable_close_to_power/,"['high voltage direct current cable', 'largest electric cable close', 'fresh green energy', 'could light 1', 'connect uk homes', '4 million homes', 'world ’', 'wind farms', 'power', 'denmark']"
18l6qb9,AI-screened eye pics diagnose childhood autism with 100% accuracy,2023-12-26T15:21:23.219000+0000,https://www.reddit.com/r/tech/comments/18l6qb9/aiscreened_eye_pics_diagnose_childhood_autism/,"['screened eye pics diagnose childhood autism', 'ai', 'accuracy', '100']"
18la2jk,Researchers invent 'methane cleaner' that could become a permanent fixture in cattle and pig barns,2024-02-12T20:45:02.837000+0000,https://www.reddit.com/r/tech/comments/18la2jk/researchers_invent_methane_cleaner_that_could/,"['researchers invent', 'pig barns', 'permanent fixture', 'methane cleaner', 'could become', 'cattle']"
18l8i9m,NASA’s Space Station Laser Comm Terminal Achieves First Link - NASA,2023-12-25T17:27:11.396000+0000,https://www.reddit.com/r/tech/comments/18l8i9m/nasas_space_station_laser_comm_terminal_achieves/,"['space station laser comm terminal achieves first link', 'nasa ’', 'nasa']"
18lav09,What Are Time Reflections And Why Are They So Promising In Tech?,2023-12-24T23:04:08.503000+0000,https://www.reddit.com/r/tech/comments/18lav09/what_are_time_reflections_and_why_are_they_so/,"['time reflections', 'tech', 'promising']"
18kn53z,"Intel, Samsung, and TSMC Demo 3D-Stacked Transistors. The Big Three can now all make CFETs—next stop on the Moore’s Law roadmap.",2023-12-23T13:47:18.252000+0000,https://www.reddit.com/r/tech/comments/18kn53z/intel_samsung_and_tsmc_demo_3dstacked_transistors/,"['make cfets — next stop', 'tsmc demo 3d', 'stacked transistors', 'moore ’', 'law roadmap', 'big three', 'samsung', 'intel']"
18k02y0,"Tiny ‘Robots’ Made From Human Cells Show Wound-Healing Potential The so-called “anthrobots” can self-assemble and move on their own, and they prompted damaged neurons to regenerate in a recent study",2023-12-23T20:46:12.891000+0000,https://www.reddit.com/r/tech/comments/18k02y0/tiny_robots_made_from_human_cells_show/,"['tiny ‘ robots ’ made', 'human cells show wound', 'called “ anthrobots ”', 'prompted damaged neurons', 'recent study', 'healing potential', 'self', 'regenerate', 'move', 'assemble']"
18jiape,"Portable, non-invasive, mind-reading AI turns thoughts into text",2023-12-22T11:30:09.939000+0000,https://www.reddit.com/r/tech/comments/18jiape/portable_noninvasive_mindreading_ai_turns/,"['reading ai turns thoughts', 'text', 'portable', 'non', 'mind', 'invasive']"
18iytaq,Wax-actuated adaptive tiles radically cut heating and cooling energy,2023-12-22T11:57:58.378000+0000,https://www.reddit.com/r/tech/comments/18iytaq/waxactuated_adaptive_tiles_radically_cut_heating/,"['actuated adaptive tiles radically cut heating', 'cooling energy', 'wax']"
18iyzqy,Ultrafast laser technology could help advance radiotherapy and treat tumors that are resistant to conventional radiotherapy.,2023-12-21T18:30:44.971000+0000,https://www.reddit.com/r/tech/comments/18iyzqy/ultrafast_laser_technology_could_help_advance/,"['ultrafast laser technology could help advance radiotherapy', 'conventional radiotherapy', 'treat tumors', 'resistant']"
18ibfdm,"US researchers become first to 3D-print steam turbine blades | ORNL researchers, in collaboration with Siemens tech, have achieved a milestone by 3D-printing large steam turbine blades.",2023-12-21T09:31:27.526000+0000,https://www.reddit.com/r/tech/comments/18ibfdm/us_researchers_become_first_to_3dprint_steam/,"['printing large steam turbine blades', 'print steam turbine blades', 'us researchers become first', 'ornl researchers', 'siemens tech', 'milestone', 'collaboration', 'achieved', '3d', '3d']"
18iagvr,AI-Powered Microdisplay Adapts to Users’ Eyesight,2023-11-20T01:13:25.641000+0000,https://www.reddit.com/r/tech/comments/18iagvr/aipowered_microdisplay_adapts_to_users_eyesight/,"['users ’ eyesight', 'powered microdisplay adapts', 'ai']"
18hgnls,Human brain-like supercomputer with 228 trillion links coming in 2024 | Australians develop a supercomputer capable of simulating networks at the scale of the human brain.,2023-12-21T01:04:09.925000+0000,https://www.reddit.com/r/tech/comments/18hgnls/human_brainlike_supercomputer_with_228_trillion/,"['228 trillion links coming', 'supercomputer capable', 'simulating networks', 'like supercomputer', 'human brain', 'human brain', 'australians develop', 'scale', '2024']"
18gmz7x,‘Biocomputer’ combines lab-grown brain tissue with electronic hardware,2023-12-20T15:02:05.780000+0000,https://www.reddit.com/r/tech/comments/18gmz7x/biocomputer_combines_labgrown_brain_tissue_with/,"['‘ biocomputer ’ combines lab', 'grown brain tissue', 'electronic hardware']"
18ftjkg,"Hyundai unveils car tires with built-in, push-button snow chains",2023-12-20T13:23:16.172000+0000,https://www.reddit.com/r/tech/comments/18ftjkg/hyundai_unveils_car_tires_with_builtin_pushbutton/,"['hyundai unveils car tires', 'button snow chains', 'push', 'built']"
18fy6c3,"Ultrasound Techniques Steers Tiny Drug Delivery Vehicles Through the Brain | For the first time, researchers have shown how microvesicles can be steered through the brain using ultrasound.",2023-12-20T01:57:48.741000+0000,https://www.reddit.com/r/tech/comments/18fy6c3/ultrasound_techniques_steers_tiny_drug_delivery/,"['ultrasound techniques steers tiny drug delivery vehicles', 'brain using ultrasound', 'first time', 'brain', 'steered', 'shown', 'researchers', 'microvesicles']"
18f635f,MIT engineers design a robotic replica of the heart’s right chamber,2023-12-20T02:50:13.565000+0000,https://www.reddit.com/r/tech/comments/18f635f/mit_engineers_design_a_robotic_replica_of_the/,"['mit engineers design', 'robotic replica', 'right chamber', 'heart ’']"
18f9o0w,GM’s hydrogen ‘power cubes’ will be used in cement mixers and terminal tractors | The automaker is one of several betting that hydrogen fuel cells can power the next generation of heavy duty vehicles.,2023-12-19T11:43:45.773000+0000,https://www.reddit.com/r/tech/comments/18f9o0w/gms_hydrogen_power_cubes_will_be_used_in_cement/,"['hydrogen ‘ power cubes ’', 'hydrogen fuel cells', 'heavy duty vehicles', 'gm ’', 'terminal tractors', 'several betting', 'next generation', 'cement mixers', 'power', 'used', 'one', 'automaker']"
18eh4ys,"Brain Implants Show Promise for People With Traumatic Brain Injuries in Small Study. Electrodes placed in the brains of five patients led to “profound” improvements in cognitive function, even years after their injuries.",2023-12-18T11:41:36.844000+0000,https://www.reddit.com/r/tech/comments/18eh4ys/brain_implants_show_promise_for_people_with/,"['“ profound ” improvements', 'brain implants show promise', 'five patients led', 'traumatic brain injuries', 'small study', 'even years', 'electrodes placed', 'cognitive function', 'injuries', 'people', 'brains']"
18dt0zt,This bold psychedelic and VR fusion therapy could spark a mental health revolution. Psychologists are exploring ways of treating mental health disorders by combining psychedelics and virtual reality.,2023-12-18T14:32:18.270000+0000,https://www.reddit.com/r/tech/comments/18dt0zt/this_bold_psychedelic_and_vr_fusion_therapy_could/,"['vr fusion therapy could spark', 'treating mental health disorders', 'mental health revolution', 'virtual reality', 'exploring ways', 'combining psychedelics', 'bold psychedelic', 'psychologists']"
18d9d87,The lucky break behind the first CRISPR treatment. Gene editing for sickle-cell is here. This is how researchers knew what DNA to change.,2024-02-09T10:10:10.176000+0000,https://www.reddit.com/r/tech/comments/18d9d87/the_lucky_break_behind_the_first_crispr_treatment/,"['lucky break behind', 'first crispr treatment', 'researchers knew', 'gene editing', 'sickle', 'dna', 'change', 'cell']"
18cy30u,Rolls Royce plans '120-inch-long' mini nuclear reactor for Moon outpost | The auto giant displayed a conceptual model design of a nuclear Space Micro-Reactor at the UK Space Conference.,2023-12-18T13:19:48.823000+0000,https://www.reddit.com/r/tech/comments/18cy30u/rolls_royce_plans_120inchlong_mini_nuclear/,"['uk space conference', 'rolls royce plans', 'nuclear space micro', 'conceptual model design', 'auto giant displayed', 'mini nuclear reactor', 'moon outpost', 'reactor', 'long', 'inch', '120']"
18cvb7h,"Researchers use wood to create low-cost, long-lasting solar cells | Kraft lignin found in wood pulp improves the stability in organic solar cells due its ability to form hydrogen bonds that acts as a sort of glue.",2023-12-18T15:06:08.626000+0000,https://www.reddit.com/r/tech/comments/18cvb7h/researchers_use_wood_to_create_lowcost/,"['organic solar cells due', 'lasting solar cells', 'wood pulp improves', 'researchers use wood', 'kraft lignin found', 'form hydrogen bonds', 'create low', 'stability', 'sort', 'long', 'glue', 'cost', 'acts', 'ability']"
18c2g5m,Under-skin implant reverses type 1 diabetes without anti-rejection drugs,2023-12-17T18:03:47.158000+0000,https://www.reddit.com/r/tech/comments/18c2g5m/underskin_implant_reverses_type_1_diabetes/,"['skin implant reverses type 1 diabetes without anti', 'rejection drugs']"
18beo76,"Listening In On Eye Movement. Researchers find auditory signals that encode how eyes move, with potential use in hearing aid tech.",2023-12-16T20:38:47.900000+0000,https://www.reddit.com/r/tech/comments/18beo76/listening_in_on_eye_movement_researchers_find/,"['researchers find auditory signals', 'hearing aid tech', 'potential use', 'eyes move', 'eye movement', 'listening', 'encode']"
18anfsy,Doughnut plasma and 100 million°C cores: How scientists could soon make nuclear fusion a reality,2023-12-16T03:40:44.832000+0000,https://www.reddit.com/r/tech/comments/18anfsy/doughnut_plasma_and_100_millionc_cores_how/,"['scientists could soon make nuclear fusion', '100 million ° c cores', 'doughnut plasma', 'reality']"
18auttw,Ultrasound can push vaccines into the body without needles | Vaccinations could be made less painful by treating skin with a vaccine-laden liquid and using ultrasound to push it into the body,2023-12-15T12:18:24.815000+0000,https://www.reddit.com/r/tech/comments/18auttw/ultrasound_can_push_vaccines_into_the_body/,"['made less painful', 'body without needles', 'vaccinations could', 'treating skin', 'laden liquid', 'using ultrasound', 'push vaccines', 'body', 'ultrasound', 'push', 'vaccine']"
18alk1b,"Lockheed Martin's tech may allow quick calibration of space payload | It is all set to showcase the capabilities of its technology — an Electronically Steerable Antenna (ESA) payload nicknamed ""Tantrum"" — through a demonstration mission.",2023-12-15T12:29:29.811000+0000,https://www.reddit.com/r/tech/comments/18alk1b/lockheed_martins_tech_may_allow_quick_calibration/,"['tech may allow quick calibration', 'electronically steerable antenna', 'space payload', 'payload nicknamed', 'lockheed martin', 'demonstration mission', 'technology —', '—', 'tantrum', 'showcase', 'set', 'esa', 'capabilities']"
189yoeu,Large earthquakes could be identified months or even years in advance by detecting unique seismic signals. That's according to new research from a team of German researchers.,2023-12-14T15:43:19.374000+0000,https://www.reddit.com/r/tech/comments/189yoeu/large_earthquakes_could_be_identified_months_or/,"['detecting unique seismic signals', 'large earthquakes could', 'new research', 'identified months', 'german researchers', 'even years', 'team', 'advance', 'according']"
18a9ocn,Texas plant to generate 10 MW of power with desk-sized turbines,2023-12-08T16:33:13.457000+0000,https://www.reddit.com/r/tech/comments/18a9ocn/texas_plant_to_generate_10_mw_of_power_with/,"['generate 10 mw', 'texas plant', 'sized turbines', 'power', 'desk']"
18ant60,"IBM releases 1,000+ qubit processor, roadmap to error correction | Company now expects useful error-corrected qubits by the end of the decade.",2023-12-14T14:59:12.019000+0000,https://www.reddit.com/r/tech/comments/18ant60/ibm_releases_1000_qubit_processor_roadmap_to/,"['ibm releases 1', 'expects useful error', 'error correction', 'qubit processor', 'corrected qubits', 'roadmap', 'end', 'decade', 'company', '000']"
189z0fe,GUIDi belt uses computer vision and haptics to guide the blind,2023-12-13T13:20:57.227000+0000,https://www.reddit.com/r/tech/comments/189z0fe/guidi_belt_uses_computer_vision_and_haptics_to/,"['guidi belt uses computer vision', 'haptics', 'guide', 'blind']"
18a3jn5,"SmartHat may be the Swiss Army knife of safety helmets | The SmartHat is designed to make things easier, by packing a head-load of gadgets into a single safety helmet.",2023-12-12T14:22:34.916000+0000,https://www.reddit.com/r/tech/comments/18a3jn5/smarthat_may_be_the_swiss_army_knife_of_safety/,"['swiss army knife', 'make things easier', 'single safety helmet', 'safety helmets', 'smarthat may', 'smarthat', 'packing', 'load', 'head', 'gadgets', 'designed']"
1899tkn,Automatic bike transmission concept is wild and spiky—and could be a big shift,2023-12-11T12:34:10.450000+0000,https://www.reddit.com/r/tech/comments/1899tkn/automatic_bike_transmission_concept_is_wild_and/,"['automatic bike transmission concept', 'spiky —', 'big shift', 'wild', 'could']"
189xq53,"China's latest non-nuclear submarine, the Type-039C Yuan Class, features a distinctive angled sail. We can now be confident that this is part of a sonar stealth technology. Other countries are also pursuing this general technique, but China is the first to field it.",2023-12-11T16:15:56.488000+0000,https://www.reddit.com/r/tech/comments/189xq53/chinas_latest_nonnuclear_submarine_the_type039c/,"['sonar stealth technology', 'distinctive angled sail', '039c yuan class', 'nuclear submarine', 'latest non', 'general technique', 'also pursuing', 'type', 'part', 'first', 'field', 'features', 'countries', 'confident', 'china', 'china']"
18995x8,"Japan Debuts Six-Story Experimental Fusion Reactor. The reactor, a forerunner for the vast ITER experiment in France, has the potential to hasten the race for cleaner energy.",2023-12-10T15:33:11.968000+0000,https://www.reddit.com/r/tech/comments/18995x8/japan_debuts_sixstory_experimental_fusion_reactor/,"['story experimental fusion reactor', 'vast iter experiment', 'japan debuts six', 'cleaner energy', 'reactor', 'race', 'potential', 'hasten', 'france', 'forerunner']"
188kupj,"AI-system boosts microgrid efficiency for rapid power outage recovery | During power outages, microgrids leverage local renewable sources like rooftop solar panels and small wind turbines for efficient power restoration.",2023-12-10T18:19:19.989000+0000,https://www.reddit.com/r/tech/comments/188kupj/aisystem_boosts_microgrid_efficiency_for_rapid/,"['microgrids leverage local renewable sources like rooftop solar panels', 'system boosts microgrid efficiency', 'rapid power outage recovery', 'small wind turbines', 'efficient power restoration', 'power outages', 'ai']"
188cq5j,Electrocaloric Material Makes Solid-State Fridge Scalable. Refrigerant-free refrigerators would be portable and efficient.,2023-12-09T16:27:03.060000+0000,https://www.reddit.com/r/tech/comments/188cq5j/electrocaloric_material_makes_solidstate_fridge/,"['electrocaloric material makes solid', 'state fridge scalable', 'free refrigerators would', 'refrigerant', 'portable', 'efficient']"
187pj5t,Michigan installs the US's first wireless EV charging public roadway,2024-02-16T21:30:26.446000+0000,https://www.reddit.com/r/tech/comments/187pj5t/michigan_installs_the_uss_first_wireless_ev/,"['first wireless ev charging public roadway', 'michigan installs', 'us']"
187xtfd,Tiny living robots made from human cells surprise scientists,2023-12-08T18:21:12.361000+0000,https://www.reddit.com/r/tech/comments/187xtfd/tiny_living_robots_made_from_human_cells_surprise/,"['tiny living robots made', 'human cells surprise scientists']"
187zg5j,At-home saliva testing could replace daily finger-jabs for diabetics,2023-12-07T23:55:03.758000+0000,https://www.reddit.com/r/tech/comments/187zg5j/athome_saliva_testing_could_replace_daily/,"['home saliva testing could replace daily finger', 'jabs', 'diabetics']"
1871ybd,New type of geothermal power plant powers data centers in the desert. Pilot plant in Nevada uses tech from fracking to generate power in arid landscape.,2023-12-07T15:30:20.463000+0000,https://www.reddit.com/r/tech/comments/1871ybd/new_type_of_geothermal_power_plant_powers_data/,"['geothermal power plant powers data centers', 'nevada uses tech', 'pilot plant', 'generate power', 'new type', 'arid landscape', 'fracking', 'desert']"
1870vlz,"Scientists make a laser accelerator with 10 billion electron-volt beam | The accelerator, an advanced wakefield laser accelerator, is under 20 feet long, generating a 10 billion electron-volt (10 GeV) electron beam.",2023-12-07T13:12:53.595000+0000,https://www.reddit.com/r/tech/comments/1870vlz/scientists_make_a_laser_accelerator_with_10/,"['advanced wakefield laser accelerator', '20 feet long', '10 billion electron', '10 billion electron', 'laser accelerator', 'electron beam', '10 gev', 'scientists make', 'volt beam', 'accelerator', 'volt', 'generating']"
186q1kd,New Neurotech Eschews Electricity for Ultrasound. Companies team up to use ultrasound-on-chip tech to develop a brain computer interface.,2023-12-06T11:59:58.687000+0000,https://www.reddit.com/r/tech/comments/186q1kd/new_neurotech_eschews_electricity_for_ultrasound/,"['new neurotech eschews electricity', 'brain computer interface', 'companies team', 'chip tech', 'use ultrasound', 'ultrasound', 'develop']"
186kurr,Cheaper microscope could bring protein mapping technique to the masses,2023-12-05T15:39:41.297000+0000,https://www.reddit.com/r/tech/comments/186kurr/cheaper_microscope_could_bring_protein_mapping/,"['cheaper microscope could bring protein mapping technique', 'masses']"
185zha0,"'Nuclear medicine': UK startup's fusion reactor could treat cancer | “Nuclear medicine has been helping to save lives for decades by enabling the medical profession to scan for cancer and directly treat tumors and cancerous cells at source,” say the founders of the startup.",2023-12-04T16:08:21.379000+0000,https://www.reddit.com/r/tech/comments/185zha0/nuclear_medicine_uk_startups_fusion_reactor_could/,"['fusion reactor could treat cancer', ""nuclear medicine ': uk startup"", '“ nuclear medicine', 'directly treat tumors', 'source ,” say', 'save lives', 'medical profession', 'cancerous cells', 'startup', 'cancer', 'scan', 'helping', 'founders', 'enabling', 'decades']"
185wf17,Researchers figure out how to bypass the fingerprint readers in most Windows PCs.,2023-12-04T21:27:48.424000+0000,https://www.reddit.com/r/tech/comments/185wf17/researchers_figure_out_how_to_bypass_the/,"['windows pcs', 'researchers figure', 'fingerprint readers', 'bypass']"
185sj2q,Elon Musk’s Brain Implant Startup Is Ready to Start Surgery,2023-12-08T16:33:13.457000+0000,https://www.reddit.com/r/tech/comments/185sj2q/elon_musks_brain_implant_startup_is_ready_to/,"['elon musk ’', 'brain implant startup', 'start surgery', 'ready']"
