post_id_tech,formatted_post_title,formatted_timestamps,post_link,keyword
1add4yt,1/100th of the cost: CPU startup Tachyum claims that one of its processing units can rival dozens of Nvidia H200 GPUs — with a 99% saving that could turn the AI market on its head if true,2024-01-31T04:48:19.168000+0000,https://www.reddit.com/r/tech/comments/1add4yt/1100th_of_the_cost_cpu_startup_tachyum_claims/,"['nvidia h200 gpus —', 'cpu startup tachyum claims', 'rival dozens', 'processing units', 'could turn', 'ai market', 'true', 'saving', 'one', 'head', 'cost', '99', '100th', '1']"
1acpwdi,Disney offers an elegant solution to VR’s movement problem | TechCrunch,2024-01-30T14:49:26.444000+0000,https://www.reddit.com/r/tech/comments/1acpwdi/disney_offers_an_elegant_solution_to_vrs_movement/,"['vr ’', 'movement problem', 'elegant solution', 'disney offers', 'techcrunch']"
1acbhjt,"NASA’s Ingenuity Mars Helicopter Has Taken Its Final Flight. Originally designed for up to five flights on Mars, Ingenuity performed 72 over three years, until one of its rotor blades was damaged during landing on January 18.",2024-01-30T12:00:53.261000+0000,https://www.reddit.com/r/tech/comments/1acbhjt/nasas_ingenuity_mars_helicopter_has_taken_its/,"['ingenuity performed 72', 'ingenuity mars helicopter', 'three years', 'rotor blades', 'originally designed', 'nasa ’', 'january 18', 'five flights', 'final flight', 'mars', 'taken', 'one', 'landing', 'damaged']"
1abh0ct,"First AI-powered handheld medical device to assist physicians in detecting all three common skin cancers: basal cell carcinoma, squamous cell carcinoma, and melanoma.",2024-01-29T12:06:58.918000+0000,https://www.reddit.com/r/tech/comments/1abh0ct/first_aipowered_handheld_medical_device_to_assist/,"['three common skin cancers', 'powered handheld medical device', 'squamous cell carcinoma', 'basal cell carcinoma', 'first ai', 'assist physicians', 'melanoma', 'detecting']"
19fazmd,World's 1st rhino pregnancy via embryo transfer offers hope to save species | Wildlife conservationists hail this groundbreaking achievement and see it as a potential step toward the protection of the critically endangered northern white rhino.,2024-01-29T15:55:09.541000+0000,https://www.reddit.com/r/tech/comments/19fazmd/worlds_1st_rhino_pregnancy_via_embryo_transfer/,"['1st rhino pregnancy via embryo transfer offers hope', 'critically endangered northern white rhino', 'wildlife conservationists hail', 'potential step toward', 'save species', 'groundbreaking achievement', 'world', 'see', 'protection']"
19f9mgt,Airborne infection risk plummets in face of metal nanoparticle spray | Silver oxide and copper oxide sprays provide a greater than 99% antiviral activity during a 24-hour period examined in the study.,2024-01-29T11:55:29.232000+0000,https://www.reddit.com/r/tech/comments/19f9mgt/airborne_infection_risk_plummets_in_face_of_metal/,"['airborne infection risk plummets', 'copper oxide sprays provide', 'metal nanoparticle spray', 'hour period examined', 'silver oxide', 'antiviral activity', 'study', 'greater', 'face', '99', '24']"
19fend9,Urease-powered nanobots for radionuclide bladder cancer therapy,2024-01-02T18:40:22.613000+0000,https://www.reddit.com/r/tech/comments/19fend9/ureasepowered_nanobots_for_radionuclide_bladder/,"['radionuclide bladder cancer therapy', 'powered nanobots', 'urease']"
19eg3rh,Gene Therapy Allows an 11-Year-Old Boy to Hear for the First Time,2024-01-28T15:49:57.262000+0000,https://www.reddit.com/r/tech/comments/19eg3rh/gene_therapy_allows_an_11yearold_boy_to_hear_for/,"['gene therapy allows', 'old boy', 'first time', 'year', 'hear', '11']"
19dnff8,Lightweight woven antenna could replace field-deployed dishes | A multi-stable deployable quadrifilar helix antenna with radiation reconfigurability for disaster-prone areas,2024-01-28T21:07:42.401000+0000,https://www.reddit.com/r/tech/comments/19dnff8/lightweight_woven_antenna_could_replace/,"['lightweight woven antenna could replace field', 'stable deployable quadrifilar helix antenna', 'radiation reconfigurability', 'prone areas', 'deployed dishes', 'multi', 'disaster']"
19dpcdy,Vibrating belt that treats low bone density gets FDA approval | The device is the first of its kind to provide a medication-free treatment option for post-menopausal women that have weakened bones.,2024-01-28T00:47:32.013000+0000,https://www.reddit.com/r/tech/comments/19dpcdy/vibrating_belt_that_treats_low_bone_density_gets/,"['treats low bone density gets fda approval', 'free treatment option', 'weakened bones', 'vibrating belt', 'menopausal women', 'provide', 'post', 'medication', 'kind', 'first', 'device']"
19cyp2d,"Liquid RAM Flexes for Wearables, Robots, Implants. A non-volatile version could be on its way, too.",2024-01-27T14:02:40.240000+0000,https://www.reddit.com/r/tech/comments/19cyp2d/liquid_ram_flexes_for_wearables_robots_implants_a/,"['volatile version could', 'liquid ram flexes', 'wearables', 'way', 'robots', 'non', 'implants']"
19czkxx,"BT Group Converts Telecom Infrastructure to EV Chargers | The telecom giant says 60,000 curbside cabinets could be adapted",2024-01-26T12:16:36.607000+0000,https://www.reddit.com/r/tech/comments/19czkxx/bt_group_converts_telecom_infrastructure_to_ev/,"['bt group converts telecom infrastructure', 'telecom giant says 60', '000 curbside cabinets could', 'ev chargers', 'adapted']"
19cj9rr,Researchers transform polluted water into fuel with urea removal | WPI researchers are turning the tide on water pollution. Their material efficiently removes urea and holds the key to turning it into clean hydrogen fuel.,2024-01-25T14:47:08.165000+0000,https://www.reddit.com/r/tech/comments/19cj9rr/researchers_transform_polluted_water_into_fuel/,"['material efficiently removes urea', 'researchers transform polluted water', 'clean hydrogen fuel', 'wpi researchers', 'water pollution', 'urea removal', 'fuel', 'turning', 'turning', 'tide', 'key', 'holds']"
19c5r5r,Diodes at Right Angles Double Autofocus Capacity. Canon twists photosensor rules to build new tech from familiar parts.,2024-01-25T13:42:56.383000+0000,https://www.reddit.com/r/tech/comments/19c5r5r/diodes_at_right_angles_double_autofocus_capacity/,"['right angles double autofocus capacity', 'canon twists photosensor rules', 'build new tech', 'familiar parts', 'diodes']"
19c1zhq,Urea-powered nanorobots reduce bladder tumors by 90% in mice,2024-01-25T17:27:08.895000+0000,https://www.reddit.com/r/tech/comments/19c1zhq/ureapowered_nanorobots_reduce_bladder_tumors_by/,"['powered nanorobots reduce bladder tumors', 'urea', 'mice', '90']"
19bgdt0,Flying Kites Deliver Container-Size Power Generation. Automated wind-energy system brings portable renewables off-grid.,2024-02-16T21:30:26.446000+0000,https://www.reddit.com/r/tech/comments/19bgdt0/flying_kites_deliver_containersize_power/,"['energy system brings portable renewables', 'flying kites deliver container', 'size power generation', 'automated wind', 'grid']"
19awd7f,Researchers develop world's first functioning graphene semiconductor | Breakthrough could eventually lead to terahertz processors,2024-01-24T12:35:54.048000+0000,https://www.reddit.com/r/tech/comments/19awd7f/researchers_develop_worlds_first_functioning/,"['first functioning graphene semiconductor', 'breakthrough could eventually lead', 'researchers develop world', 'terahertz processors']"
19aw6pu,Experts craft life-saving 'robot medics' for triage in high-risk places,2024-01-23T12:34:35.224000+0000,https://www.reddit.com/r/tech/comments/19aw6pu/experts_craft_lifesaving_robot_medics_for_triage/,"['experts craft life', 'robot medics', 'risk places', 'triage', 'saving', 'high']"
19ajjit,The next generation of nuclear reactors is getting more advanced. Here’s how.,2024-01-23T14:14:21.856000+0000,https://www.reddit.com/r/tech/comments/19ajjit/the_next_generation_of_nuclear_reactors_is/,"['nuclear reactors', 'next generation', '’', 'getting', 'advanced']"
19a81tm,Researchers develop artificial 'power plants' in the form of tiny leaf-shapes to harness energy from the wind and rain.,2024-01-22T15:51:46.841000+0000,https://www.reddit.com/r/tech/comments/19a81tm/researchers_develop_artificial_power_plants_in/,"['researchers develop artificial', 'tiny leaf', 'power plants', 'harness energy', 'wind', 'shapes', 'rain', 'form']"
199oo7c,"Crop Health Sensor Runs on Solar, Microbe Power | Electrical measurements on plant stem enable better water resource monitoring",2024-01-22T16:29:13.268000+0000,https://www.reddit.com/r/tech/comments/199oo7c/crop_health_sensor_runs_on_solar_microbe_power/,"['plant stem enable better water resource monitoring', 'crop health sensor runs', 'microbe power', 'electrical measurements', 'solar']"
199odht,EU breakthrough laser beams could power nanosatellites in space wirelessly | The research project demonstrated a power output of 20 watts using a fiber-optic laser and aims to increase this to kilowatts in the future.,2024-01-22T01:06:44.980000+0000,https://www.reddit.com/r/tech/comments/199odht/eu_breakthrough_laser_beams_could_power/,"['eu breakthrough laser beams could power nanosatellites', 'research project demonstrated', '20 watts using', 'power output', 'optic laser', 'space wirelessly', 'kilowatts', 'increase', 'future', 'fiber', 'aims']"
198v99i,"""Dirt-powered fuel cell"" draws near-limitless energy from soil | Paperback-sized device that nestles in soil, harvests power created as microbes break down dirt.",2024-01-21T15:26:42.931000+0000,https://www.reddit.com/r/tech/comments/198v99i/dirtpowered_fuel_cell_draws_nearlimitless_energy/,"['powered fuel cell', 'harvests power created', 'sized device', 'microbes break', 'limitless energy', 'draws near', 'soil', 'soil', 'paperback', 'nestles', 'dirt', 'dirt']"
198v1gl,"Researchers use wireless sensor 5 times thinner than hair to map brain | UC San Diego researchers unveil a revolutionary brain monitoring system, enabling high-resolution, wireless recording in deep brain structures for diverse clinical applications.",2024-01-21T12:03:08.559000+0000,https://www.reddit.com/r/tech/comments/198v1gl/researchers_use_wireless_sensor_5_times_thinner/,"['researchers use wireless sensor 5 times thinner', 'uc san diego researchers unveil', 'revolutionary brain monitoring system', 'diverse clinical applications', 'deep brain structures', 'wireless recording', 'map brain', 'enabling high', 'resolution', 'hair']"
1984zdt,Mesh Wearables Meld Micro Sensors and LoRa Smarts. Say goodbye to box-and-strap wearable tech of old.,2023-12-08T16:33:13.457000+0000,https://www.reddit.com/r/tech/comments/1984zdt/mesh_wearables_meld_micro_sensors_and_lora_smarts/,"['mesh wearables meld micro sensors', 'strap wearable tech', 'say goodbye', 'lora smarts', 'old', 'box']"
197ccra,Daimler Truck Fuels Big Rigs With Hydrogen GenH2’s fuel-cell-powered semi will hit German roads by middle of this year,2024-01-20T17:06:11.598000+0000,https://www.reddit.com/r/tech/comments/197ccra/daimler_truck_fuels_big_rigs_with_hydrogen_genh2s/,"['daimler truck fuels big rigs', 'hydrogen genh2 ’', 'hit german roads', 'powered semi', 'year', 'middle', 'fuel', 'cell']"
196fcxp,MIT’s New Desalination System Produces Freshwater That Is “Cheaper Than Tap Water”,2024-01-19T22:55:44.640000+0000,https://www.reddit.com/r/tech/comments/196fcxp/mits_new_desalination_system_produces_freshwater/,"['new desalination system produces freshwater', 'tap water ”', '“ cheaper', 'mit ’']"
196fba6,Biotagging method for animal identification using dissolvable microneedle arrays prepared by customisable moulds,2024-01-19T22:48:09.733000+0000,https://www.reddit.com/r/tech/comments/196fba6/biotagging_method_for_animal_identification_using/,"['animal identification using dissolvable microneedle arrays prepared', 'customisable moulds', 'biotagging method']"
195pom2,The innovation that gets an Alzheimer’s drug through the blood-brain barrier. Focused ultrasound is just one strategy researchers are using to get drugs into the brain.,2024-01-19T13:50:52.423000+0000,https://www.reddit.com/r/tech/comments/195pom2/the_innovation_that_gets_an_alzheimers_drug/,"['one strategy researchers', 'get drugs', 'focused ultrasound', 'alzheimer ’', 'brain barrier', 'brain', 'using', 'innovation', 'gets', 'drug', 'blood']"
195j95f,Autophage rocket engine consumes plastic fuselage for fuel,2024-01-19T02:22:31.773000+0000,https://www.reddit.com/r/tech/comments/195j95f/autophage_rocket_engine_consumes_plastic_fuselage/,"['autophage rocket engine consumes plastic fuselage', 'fuel']"
194u6e1,"""Millennium Camera"" to take a 1,000-year long-exposure photo",2024-01-18T12:06:20.236000+0000,https://www.reddit.com/r/tech/comments/194u6e1/millennium_camera_to_take_a_1000year_longexposure/,"['year long', 'millennium camera', 'exposure photo', 'take', '1', '000']"
194hvcu,"Researchers trap CO2 from air into nanofibers to prevent its release | The two-step process also produces hydrogen gas as a by-product, which could also be used as a zero-emission fuel.",2024-01-18T11:48:58.385000+0000,https://www.reddit.com/r/tech/comments/194hvcu/researchers_trap_co2_from_air_into_nanofibers_to/,"['step process also produces hydrogen gas', 'researchers trap co2', 'could also', 'emission fuel', 'zero', 'used', 'two', 'release', 'product', 'prevent', 'nanofibers', 'air']"
1949o4t,Innovative design achieves tenfold better resolution for functional MRI brain imaging,2024-01-17T12:18:24.736000+0000,https://www.reddit.com/r/tech/comments/1949o4t/innovative_design_achieves_tenfold_better/,"['innovative design achieves tenfold better resolution', 'functional mri brain imaging']"
194imwe,How Microsoft found a potential new battery material using AI,2024-01-22T19:51:08.415000+0000,https://www.reddit.com/r/tech/comments/194imwe/how_microsoft_found_a_potential_new_battery/,"['potential new battery material using ai', 'microsoft found']"
1940hv0,"E-Nose Sniffs Out Coffee Varieties Nearly Perfectly | Like Shazam but for java, the tech can help quantify coffee signatures",2024-01-17T12:05:35.350000+0000,https://www.reddit.com/r/tech/comments/1940hv0/enose_sniffs_out_coffee_varieties_nearly/,"['help quantify coffee signatures', 'coffee varieties nearly perfectly', 'nose sniffs', 'like shazam', 'tech', 'java', 'e']"
19393xw,10x Stronger Than Kevlar: Amorphous Silicon Carbide Could Revolutionize Material Science,2024-01-16T15:06:16.323000+0000,https://www.reddit.com/r/tech/comments/19393xw/10x_stronger_than_kevlar_amorphous_silicon/,"['amorphous silicon carbide could revolutionize material science', '10x stronger', 'kevlar']"
1936gzk,Qualcomm's first-of-its-kind SoC can handle infotainment and ADAS on one chip,2024-01-15T16:09:46.683000+0000,https://www.reddit.com/r/tech/comments/1936gzk/qualcomms_firstofitskind_soc_can_handle/,"['one chip', 'kind soc', 'handle infotainment', 'qualcomm', 'first', 'adas']"
192kjg0,"Solid-state battery design offers 6,000 cycles and 10-minute charge | The design solves dendrite-related issues by creating a multilayer battery with diverse materials and managing dendrites by containment.",2024-01-14T12:59:48.503000+0000,https://www.reddit.com/r/tech/comments/192kjg0/solidstate_battery_design_offers_6000_cycles_and/,"['state battery design offers 6', 'design solves dendrite', 'multilayer battery', 'related issues', 'minute charge', 'managing dendrites', 'diverse materials', '000 cycles', 'solid', 'creating', 'containment', '10']"
192efjm,Air-steered X-65 jet from DARPA enters manufacturing phase,2024-01-14T12:57:08.307000+0000,https://www.reddit.com/r/tech/comments/192efjm/airsteered_x65_jet_from_darpa_enters/,"['darpa enters manufacturing phase', 'steered x', '65 jet', 'air']"
191qrib,A light sail that could one day propel small spacecraft through interstellar realms is headed to the International Space Station and will be tested by astronauts on behalf of Cornell’s Space Systems Design Studio.,2024-01-13T14:53:52.799000+0000,https://www.reddit.com/r/tech/comments/191qrib/a_light_sail_that_could_one_day_propel_small/,"['could one day propel small spacecraft', 'space systems design studio', 'international space station', 'light sail', 'interstellar realms', 'cornell ’', 'tested', 'headed', 'behalf', 'astronauts']"
191b8t3,These AI-powered apps can hear the cause of a cough,2024-01-13T08:15:55.498000+0000,https://www.reddit.com/r/tech/comments/191b8t3/these_aipowered_apps_can_hear_the_cause_of_a_cough/,"['powered apps', 'hear', 'cough', 'cause', 'ai']"
190wtkh,Silk-Based Transistors For Hybrid Applications. Silk incorporated as insulators could grant new sensing abilities to transistors.,2024-01-12T12:43:58.936000+0000,https://www.reddit.com/r/tech/comments/190wtkh/silkbased_transistors_for_hybrid_applications/,"['insulators could grant new sensing abilities', 'hybrid applications', 'silk incorporated', 'based transistors', 'transistors', 'silk']"
19095ad,"Wearable Robotic Exosuit Improves Walking for Individuals With Parkinson’s Disease | Robotic exosuit eliminated gait freezing, a common and highly debilitating symptom.",2024-02-12T20:45:02.837000+0000,https://www.reddit.com/r/tech/comments/19095ad/wearable_robotic_exosuit_improves_walking_for/,"['wearable robotic exosuit improves walking', 'robotic exosuit eliminated gait freezing', 'highly debilitating symptom', 'parkinson ’', 'individuals', 'disease', 'common']"
18zyj4t,Eye-tracking window tech tells sightseers about what they're looking at,2024-01-12T00:53:31.038000+0000,https://www.reddit.com/r/tech/comments/18zyj4t/eyetracking_window_tech_tells_sightseers_about/,"['tracking window tech tells sightseers', 'looking', 'eye']"
18z5end,‘Smart tweezer’ can pluck out single bacterium target from microbiome,2024-01-11T19:09:39.707000+0000,https://www.reddit.com/r/tech/comments/18z5end/smart_tweezer_can_pluck_out_single_bacterium/,"['‘ smart tweezer ’', 'single bacterium target', 'pluck', 'microbiome']"
18yc3yv,"In a breakthrough, diabetics’ damaged cells regenerated to produce insulin | The discovery could mean that, one day, diabetics won't need to take multiple daily insulin injections.",2024-01-12T01:28:47.080000+0000,https://www.reddit.com/r/tech/comments/18yc3yv/in_a_breakthrough_diabetics_damaged_cells/,"['take multiple daily insulin injections', 'diabetics ’ damaged cells regenerated', 'discovery could mean', 'produce insulin', 'one day', 'diabetics', 'need', 'breakthrough']"
18ymjpj,World's first partial heart transplant grows valves and arteries | This method can 'potentially double the number of hearts that are used for the benefit of children with heart disease.',2024-01-11T12:24:08.117000+0000,https://www.reddit.com/r/tech/comments/18ymjpj/worlds_first_partial_heart_transplant_grows/,"['first partial heart transplant grows valves', ""heart disease .'"", 'potentially double', 'world', 'used', 'number', 'method', 'hearts', 'children', 'benefit', 'arteries']"
18ybfmm,Non-toxic materials open door for better cameras on consumer electronics | Researchers from ICFO and Qurv have developed a new type of quantum dots that are non-toxic and phosphine-free and can achieve high performance in the SWIR range.,2024-01-10T14:09:40.036000+0000,https://www.reddit.com/r/tech/comments/18ybfmm/nontoxic_materials_open_door_for_better_cameras/,"['toxic materials open door', 'achieve high performance', 'swir range', 'quantum dots', 'new type', 'consumer electronics', 'better cameras', 'toxic', 'researchers', 'qurv', 'phosphine', 'non', 'non', 'icfo', 'free', 'developed']"
18xo622,Scientists invent heat-controlling circuitry that keeps electronics cool,2024-01-10T11:47:39.675000+0000,https://www.reddit.com/r/tech/comments/18xo622/scientists_invent_heatcontrolling_circuitry_that/,"['scientists invent heat', 'keeps electronics cool', 'controlling circuitry']"
18xnv3s,"Researchers have successfully engineered the world's first functional semiconductor using graphene | In the 21st century, the pursuit is to develop electronic devices that are both smaller and faster, whether for applications in the medical sector or robotics.",2024-01-09T17:43:13.780000+0000,https://www.reddit.com/r/tech/comments/18xnv3s/researchers_have_successfully_engineered_the/,"['first functional semiconductor using graphene', 'develop electronic devices', 'successfully engineered', 'medical sector', '21st century', 'world', 'whether', 'smaller', 'robotics', 'researchers', 'pursuit', 'faster', 'applications']"
18wys6z,"SR-72: US secret hypersonic jet to allegedly break sound barrier in 2025 | Believed to be a top-secret project of the US Air Force, the SR-72 is touted to reach over 4,000 mph (6,437 kph), making it the fastest plane ever developed.",2024-01-09T13:14:09.367000+0000,https://www.reddit.com/r/tech/comments/18wys6z/sr72_us_secret_hypersonic_jet_to_allegedly_break/,"['fastest plane ever developed', 'allegedly break sound barrier', '437 kph ), making', 'us secret hypersonic jet', 'us air force', 'secret project', '000 mph', 'touted', 'top', 'sr', 'sr', 'reach', 'believed', '72', '72', '6', '4', '2025']"
18wcqji,Nanotech Energy announces 18650 lithium-ion battery that resists burning down homes and cars,2023-12-08T16:33:13.457000+0000,https://www.reddit.com/r/tech/comments/18wcqji/nanotech_energy_announces_18650_lithiumion/,"['nanotech energy announces 18650 lithium', 'resists burning', 'ion battery', 'homes', 'cars']"
18vzsdn,"In a new study, Cornell scientists show that genetically engineering bacteria could improve the efficiency for the purification of elements found in smartphones, computers, electric cars and wind turbines, and could even boost global economic supply chains.",2024-01-08T17:36:21.454000+0000,https://www.reddit.com/r/tech/comments/18vzsdn/in_a_new_study_cornell_scientists_show_that/,"['could even boost global economic supply chains', 'genetically engineering bacteria could improve', 'cornell scientists show', 'wind turbines', 'new study', 'elements found', 'electric cars', 'smartphones', 'purification', 'efficiency', 'computers']"
18uhv4b,"A high-tech mouthguard that might help prevent concussions. Designed for athletes and soldiers, this new device provides real-time measurements of head impacts, reducing the risk of traumatic brain injury.",2024-01-08T03:25:04.471000+0000,https://www.reddit.com/r/tech/comments/18uhv4b/a_hightech_mouthguard_that_might_help_prevent/,"['new device provides real', 'might help prevent concussions', 'traumatic brain injury', 'time measurements', 'tech mouthguard', 'head impacts', 'soldiers', 'risk', 'reducing', 'high', 'designed', 'athletes']"
18tqz3n,Scientists develop 'flying dragon' robot to fight fires from a distance,2024-01-07T17:08:46.072000+0000,https://www.reddit.com/r/tech/comments/18tqz3n/scientists_develop_flying_dragon_robot_to_fight/,"['scientists develop', 'flying dragon', 'fight fires', 'robot', 'distance']"
18tmnxh,Physicists upgrade world's biggest atom smasher to probe dark photons | The Compact Muon Solenoid (CMS) ongoing Run 3 experiment has presented its initial findings about the elusive dark photons.,2024-01-06T20:22:17.648000+0000,https://www.reddit.com/r/tech/comments/18tmnxh/physicists_upgrade_worlds_biggest_atom_smasher_to/,"['ongoing run 3 experiment', 'probe dark photons', 'physicists upgrade world', 'elusive dark photons', 'compact muon solenoid', 'biggest atom smasher', 'initial findings', 'presented', 'cms']"
18t51pq,The first EV with a lithium-free sodium battery hits the road in January,2024-01-06T11:59:27.560000+0000,https://www.reddit.com/r/tech/comments/18t51pq/the_first_ev_with_a_lithiumfree_sodium_battery/,"['free sodium battery hits', 'first ev', 'road', 'lithium', 'january']"
18tanws,"High-tech mouthguard with sensors redefines safety in sports, military | A cutting-edge mouthguard designed for athletes and soldiers is preventing concussions by 'sensing' real-time head impacts.",2024-01-05T12:07:41.352000+0000,https://www.reddit.com/r/tech/comments/18tanws/hightech_mouthguard_with_sensors_redefines_safety/,"['time head impacts', 'sensors redefines safety', 'edge mouthguard designed', 'tech mouthguard', 'preventing concussions', 'sports', 'soldiers', 'sensing', 'real', 'military', 'high', 'cutting', 'athletes']"
18ss7tf,"CERN's LHC to explore new frontiers with US-made superconducting magnets | The upgrade, known as the high-luminosity LHC (HL-LHC), will require new types of magnets to focus the beams of protons more tightly at the collision points of the ATLAS and CMS experiments.",2024-01-04T12:33:19.234000+0000,https://www.reddit.com/r/tech/comments/18ss7tf/cerns_lhc_to_explore_new_frontiers_with_usmade/,"['require new types', 'explore new frontiers', 'made superconducting magnets', 'collision points', 'cms experiments', 'luminosity lhc', 'lhc ),', 'magnets', 'lhc', 'us', 'upgrade', 'tightly', 'protons', 'known', 'hl', 'high', 'focus', 'cern', 'beams', 'atlas']"
18sx3yn,This E-tongue mimicks human taste and recommends wine with different foods | Scientists pave the way for new culinary frontiers.,2024-01-04T20:08:14.027000+0000,https://www.reddit.com/r/tech/comments/18sx3yn/this_etongue_mimicks_human_taste_and_recommends/,"['tongue mimicks human taste', 'new culinary frontiers', 'scientists pave', 'recommends wine', 'different foods', 'way', 'e']"
18s4n14,Moderna’s mRNA cancer vaccine works even better than thought,2024-02-16T21:30:26.446000+0000,https://www.reddit.com/r/tech/comments/18s4n14/modernas_mrna_cancer_vaccine_works_even_better/,"['mrna cancer vaccine works even better', 'moderna ’', 'thought']"
