post_id_tech,formatted_post_title,formatted_timestamps,post_link,keyword
1852q42,A new study used a device that reshapes images into sound signals to let blind people “see” facial features | The results have shed new light on the brain areas used to identify and process faces.,2023-12-04T14:38:47.118000+0000,https://www.reddit.com/r/tech/comments/1852q42/a_new_study_used_a_device_that_reshapes_images/,"['let blind people “ see ” facial features', 'shed new light', 'new study used', 'brain areas used', 'sound signals', 'reshapes images', 'process faces', 'results', 'identify', 'device']"
184h9f4,"Arizona's solar-over-canal project will tackle its major drought issue | As well as tackling much of the state's moderate to extreme water evaporation conditions, the initiative will also generate clean energy.",2023-12-03T17:42:24.324000+0000,https://www.reddit.com/r/tech/comments/184h9f4/arizonas_solarovercanal_project_will_tackle_its/,"['extreme water evaporation conditions', 'also generate clean energy', 'major drought issue', 'tackling much', 'canal project', 'well', 'tackle', 'state', 'solar', 'moderate', 'initiative', 'arizona']"
183uvgc,"Chemists Unveil the Slickest Surface Ever to Ward Off Water The discovery holds potential for various applications, including self-cleaning surfaces and de-icing glass, in in which droplet-repellent surfaces are useful.",2023-12-04T02:05:57.499000+0000,https://www.reddit.com/r/tech/comments/183uvgc/chemists_unveil_the_slickest_surface_ever_to_ward/,"['slickest surface ever', 'discovery holds potential', 'various applications', 'repellent surfaces', 'including self', 'icing glass', 'cleaning surfaces', 'chemists unveil', 'water', 'ward', 'useful', 'droplet', 'de']"
183bnp3,Absorbable scaffold beats angioplasty for lower-leg artery disease,2023-12-04T16:25:37.617000+0000,https://www.reddit.com/r/tech/comments/183bnp3/absorbable_scaffold_beats_angioplasty_for/,"['absorbable scaffold beats angioplasty', 'leg artery disease', 'lower']"
183cj30,Silk Meets Silicon: The Dawn of Biological Hybrid Transistors,2023-12-03T17:57:53.261000+0000,https://www.reddit.com/r/tech/comments/183cj30/silk_meets_silicon_the_dawn_of_biological_hybrid/,"['silk meets silicon', 'biological hybrid transistors', 'dawn']"
1834zqm,Robotic excavator builds a giant stone wall with no human assistance,2023-12-03T21:16:24.803000+0000,https://www.reddit.com/r/tech/comments/1834zqm/robotic_excavator_builds_a_giant_stone_wall_with/,"['robotic excavator builds', 'giant stone wall', 'human assistance']"
182y2qf,PhD student bioengineers potato plant to detect gamma radiation,2023-12-02T18:28:07.405000+0000,https://www.reddit.com/r/tech/comments/182y2qf/phd_student_bioengineers_potato_plant_to_detect/,"['phd student bioengineers potato plant', 'detect gamma radiation']"
182w4cz,UK’s unique heat-capturing glass tubes are keeping US fishermen warm | Heating and cooling needs account for 50 percent of energy demand and using the Sun's heat directly is an effective to curb fossil fuel requirements.,2023-12-03T16:57:36.634000+0000,https://www.reddit.com/r/tech/comments/182w4cz/uks_unique_heatcapturing_glass_tubes_are_keeping/,"['keeping us fishermen warm', 'curb fossil fuel requirements', 'cooling needs account', 'capturing glass tubes', 'unique heat', 'uk ’', 'heat directly', 'energy demand', '50 percent', 'using', 'sun', 'heating', 'effective']"
182d4bi,Scientists find way to wipe a cell's memory to better reprogram it as a stem cell,2024-02-12T20:45:24.709000+0000,https://www.reddit.com/r/tech/comments/182d4bi/scientists_find_way_to_wipe_a_cells_memory_to/,"['scientists find way', 'better reprogram', 'stem cell', 'cell', 'wipe', 'memory']"
181fwwq,Spinal Stimulator's Gentle Zaps Help Treat Parkinson's,2023-12-02T17:57:18.795000+0000,https://www.reddit.com/r/tech/comments/181fwwq/spinal_stimulators_gentle_zaps_help_treat/,"['gentle zaps help treat parkinson', 'spinal stimulator']"
181iywr,Airdropped spinning-seed-inspired sensors could monitor soil moisture,2023-12-01T19:57:15.570000+0000,https://www.reddit.com/r/tech/comments/181iywr/airdropped_spinningseedinspired_sensors_could/,"['inspired sensors could monitor soil moisture', 'airdropped spinning', 'seed']"
1819u22,"Next-gen air conditioning: new electrocaloric material could replace harmful refrigerants | A new, performing solution to the issue of environmentally unfriendly air conditioning systems",2023-12-01T14:07:59.410000+0000,https://www.reddit.com/r/tech/comments/1819u22/nextgen_air_conditioning_new_electrocaloric/,"['new electrocaloric material could replace harmful refrigerants', 'environmentally unfriendly air conditioning systems', 'gen air conditioning', 'performing solution', 'new', 'next', 'issue']"
180crnc,FDA considers first CRISPR gene editing treatment that may cure sickle cell,2023-11-30T18:33:36.339000+0000,https://www.reddit.com/r/tech/comments/180crnc/fda_considers_first_crispr_gene_editing_treatment/,"['fda considers first crispr gene editing treatment', 'may cure sickle cell']"
180k1h8,Jet powered by PW800 engines wraps transatlantic trip using 100% SAF | The aircraft engines ran on a sustainable aviation fuel comprising hydro-processed Esters and Fatty Acids.,2023-12-01T00:22:25.459000+0000,https://www.reddit.com/r/tech/comments/180k1h8/jet_powered_by_pw800_engines_wraps_transatlantic/,"['pw800 engines wraps transatlantic trip using 100', 'sustainable aviation fuel comprising hydro', 'aircraft engines ran', 'processed esters', 'jet powered', 'fatty acids', 'saf']"
180e168,New device allows the brain to function independently from the body | The innovative system is known as extracorporeal pulsatile circulatory control (EPCC).,2023-12-01T01:36:02.043000+0000,https://www.reddit.com/r/tech/comments/180e168/new_device_allows_the_brain_to_function/,"['extracorporeal pulsatile circulatory control', 'new device allows', 'innovative system', 'function independently', 'epcc ).', 'known', 'brain', 'body']"
17zqjwy,MIT tests new ingestible sensor that records your breathing through your intestines,2023-11-29T22:26:16.839000+0000,https://www.reddit.com/r/tech/comments/17zqjwy/mit_tests_new_ingestible_sensor_that_records_your/,"['mit tests new ingestible sensor', 'records', 'intestines', 'breathing']"
17z9bt7,"How tiny hinges bend the infection-spreading spikes of a coronavirus. Disabling those hinges could be a good strategy for designing vaccines and treatments against a broad range of coronavirus infections, including COVID-19.",2023-11-29T21:40:40.739000+0000,https://www.reddit.com/r/tech/comments/17z9bt7/how_tiny_hinges_bend_the_infectionspreading/,"['tiny hinges bend', 'hinges could', 'spreading spikes', 'including covid', 'good strategy', 'designing vaccines', 'broad range', 'coronavirus infections', 'coronavirus', 'treatments', 'infection', 'disabling', '19']"
17zjsqn,Running thousands of LLMs on one GPU is now possible with S-LoRA,2023-11-29T14:00:35.463000+0000,https://www.reddit.com/r/tech/comments/17zjsqn/running_thousands_of_llms_on_one_gpu_is_now/,"['running thousands', 'one gpu', 'possible', 'lora', 'llms']"
17ycvwi,"Scientists 3D print a robotic hand with human-like bones and tendons. As a layer is printed, an optical scan IDs flaws and corrects them in the next layer.",2024-02-09T10:10:10.176000+0000,https://www.reddit.com/r/tech/comments/17ycvwi/scientists_3d_print_a_robotic_hand_with_humanlike/,"['optical scan ids flaws', 'scientists 3d print', 'robotic hand', 'like bones', 'next layer', 'layer', 'tendons', 'printed', 'human', 'corrects']"
17xmvmg,Swallowable device tracking vital signs inside the body in human trial | The device is part of a growing field of ingestible devices that can perform various functions inside the body.,2023-11-29T08:39:06.256000+0000,https://www.reddit.com/r/tech/comments/17xmvmg/swallowable_device_tracking_vital_signs_inside/,"['swallowable device tracking vital signs inside', 'perform various functions inside', 'ingestible devices', 'human trial', 'growing field', 'device', 'part', 'body', 'body']"
