post_id_tech,formatted_post_title,formatted_timestamps,post_link,keyword
1at99aw,Microscopic robots could soon float inside your liver to fight cancer. Canadian researchers are closing in on a novel approach to treat liver tumours using microrobots in a MRI device.,2024-02-17T18:55:06.569000+0000,https://www.reddit.com/r/tech/comments/1at99aw/microscopic_robots_could_soon_float_inside_your/,"['microscopic robots could soon float inside', 'treat liver tumours using microrobots', 'novel approach', 'mri device', 'fight cancer', 'canadian researchers', 'liver', 'closing']"
1asxvnn,‘Humanity’s remaining timeline? It looks more like five years than 50’: meet the neo-luddites warning of an AI apocalypse,2023-12-08T14:31:02.726000+0000,https://www.reddit.com/r/tech/comments/1asxvnn/humanitys_remaining_timeline_it_looks_more_like/,"['‘ humanity ’', 'like five years', '50 ’: meet', 'remaining timeline', 'luddites warning', 'ai apocalypse', 'neo', 'looks']"
1ataibg,"Nvidia reveals its Eos supercomputer for AI processing sporting 4,608 H100 GPUs | Its the ninth fastest supercomputer in the world",2024-02-17T09:15:38.375000+0000,https://www.reddit.com/r/tech/comments/1ataibg/nvidia_reveals_its_eos_supercomputer_for_ai/,"['ai processing sporting 4', '608 h100 gpus', 'ninth fastest supercomputer', 'eos supercomputer', 'nvidia reveals', 'world']"
1asawcw,New Solid Electrolyte Matches Liquid Performance. Better solid electrolytes could result in safer batteries that don’t explode.,2024-02-17T19:47:56.082000+0000,https://www.reddit.com/r/tech/comments/1asawcw/new_solid_electrolyte_matches_liquid_performance/,"['new solid electrolyte matches liquid performance', 'better solid electrolytes could result', 'safer batteries', '’', 'explode']"
1asnwma,New chip opens door to AI computing at light speed,2024-02-16T15:10:43.764000+0000,https://www.reddit.com/r/tech/comments/1asnwma/new_chip_opens_door_to_ai_computing_at_light_speed/,"['new chip opens door', 'light speed', 'ai computing']"
1as5xs9,US researchers develop 'unhackable' computer chip that works on light | Computations can be performed at light speed in this chip which is ready for deployment for building AI models immediately.,2024-02-17T00:07:33.274000+0000,https://www.reddit.com/r/tech/comments/1as5xs9/us_researchers_develop_unhackable_computer_chip/,"['building ai models immediately', 'us researchers develop', 'light speed', 'computer chip', 'light', 'chip', 'works', 'unhackable', 'ready', 'performed', 'deployment', 'computations']"
1as7458,"LED glass basketball court to make NBA debut this month, displaying stats and replays | Courts can also display other entertainment content and host potentially any hardcourt sport",2024-02-16T11:02:01.638000+0000,https://www.reddit.com/r/tech/comments/1as7458/led_glass_basketball_court_to_make_nba_debut_this/,"['led glass basketball court', 'make nba debut', 'host potentially', 'hardcourt sport', 'entertainment content', 'displaying stats', 'also display', 'replays', 'month', 'courts']"
1arxn30,The existence of a new kind of magnetism has been confirmed,2024-02-16T12:11:52.407000+0000,https://www.reddit.com/r/tech/comments/1arxn30/the_existence_of_a_new_kind_of_magnetism_has_been/,"['new kind', 'magnetism', 'existence', 'confirmed']"
1ardw87,Ultrasound waves spark movement in sleepy sperm by up to 266%,2024-02-16T02:33:40.004000+0000,https://www.reddit.com/r/tech/comments/1ardw87/ultrasound_waves_spark_movement_in_sleepy_sperm/,"['ultrasound waves spark movement', 'sleepy sperm', '266']"
1arxuvo,Open AI can now create video from text,2024-02-15T12:01:22.711000+0000,https://www.reddit.com/r/tech/comments/1arxuvo/open_ai_can_now_create_video_from_text/,"['open ai', 'create video', 'text']"
1armyjr,"Surgical robot, MIRA, aces zero-gravity examination in space | SpaceMIRA, a miniature surgical robot, excels in zero gravity, promising revolutionary advances in remote surgery and healthcare accessibility worldwide.",2024-02-16T02:44:39.568000+0000,https://www.reddit.com/r/tech/comments/1armyjr/surgical_robot_mira_aces_zerogravity_examination/,"['promising revolutionary advances', 'healthcare accessibility worldwide', 'miniature surgical robot', 'surgical robot', 'zero gravity', 'remote surgery', 'gravity examination', 'aces zero', 'spacemira', 'space', 'mira', 'excels']"
1ar2uvn,"Magnetic robotic catheter devised to efficiently treat ischemic strokes | The cutting-edge device with helical surface and rotational motion can navigate the vascular system efficiently, targeting diseased blood vessels with precision.",2023-12-08T14:31:02.726000+0000,https://www.reddit.com/r/tech/comments/1ar2uvn/magnetic_robotic_catheter_devised_to_efficiently/,"['targeting diseased blood vessels', 'magnetic robotic catheter devised', 'efficiently treat ischemic strokes', 'vascular system efficiently', 'rotational motion', 'helical surface', 'edge device', 'precision', 'navigate', 'cutting']"
1aqopii,NASA Puts Next-Gen Exoplanet-Imaging Technology to the Test,2024-02-15T18:52:50.825000+0000,https://www.reddit.com/r/tech/comments/1aqopii/nasa_puts_nextgen_exoplanetimaging_technology_to/,"['nasa puts next', 'imaging technology', 'gen exoplanet', 'test']"
1aqgfw8,Open-Source Security Chip Released. The first commercial chip based on the OpenTitan hardware security design has hit the market.,2024-02-15T00:45:38.515000+0000,https://www.reddit.com/r/tech/comments/1aqgfw8/opensource_security_chip_released_the_first/,"['source security chip released', 'opentitan hardware security design', 'first commercial chip based', 'open', 'market', 'hit']"
1aq4lah,"Replacement cartilage can grow in any shape with 3D-printed ""spheroids""",2024-02-14T14:53:05.949000+0000,https://www.reddit.com/r/tech/comments/1aq4lah/replacement_cartilage_can_grow_in_any_shape_with/,"['replacement cartilage', 'spheroids', 'shape', 'printed', 'grow', '3d']"
1aprvb2,"Chinese researchers develop calcium-based battery that lasts 700 cycles | Stable in the air at room temperature, the calcium-oxygen battery can be transformed into flexible fibers for next-gen wearables.",2024-02-14T06:34:16.148000+0000,https://www.reddit.com/r/tech/comments/1aprvb2/chinese_researchers_develop_calciumbased_battery/,"['chinese researchers develop calcium', 'lasts 700 cycles', 'room temperature', 'oxygen battery', 'gen wearables', 'flexible fibers', 'based battery', 'calcium', 'transformed', 'stable', 'next', 'air']"
1aq3geq,OpenAI CEO warns that 'societal misalignments' could make artificial intelligence dangerous,2024-02-13T21:07:53.955000+0000,https://www.reddit.com/r/tech/comments/1aq3geq/openai_ceo_warns_that_societal_misalignments/,"['could make artificial intelligence dangerous', 'openai ceo warns', 'societal misalignments']"
1aozkt0,"28-ton, 1.2-megawatt tidal kite is now exporting power to the grid",2024-02-13T12:04:27.407000+0000,https://www.reddit.com/r/tech/comments/1aozkt0/28ton_12megawatt_tidal_kite_is_now_exporting/,"['megawatt tidal kite', 'exporting power', 'ton', 'grid', '28', '2', '1']"
1ap2drh,Shining Laser Light on Glass Creates a Solar Cell | New energy and sensor applications could await,2024-02-13T20:21:39.876000+0000,https://www.reddit.com/r/tech/comments/1ap2drh/shining_laser_light_on_glass_creates_a_solar_cell/,"['sensor applications could await', 'shining laser light', 'solar cell', 'new energy', 'glass creates']"
1aop1vh,"Tokyo scientists create nanoscrolls for next-gen tech | Researchers achieved a major breakthrough by crafting nanoscrolls using Janus nanosheets. This innovation unlocks doors to exciting possibilities in catalysis, optics, and clean energy.",2024-02-12T13:05:41.010000+0000,https://www.reddit.com/r/tech/comments/1aop1vh/tokyo_scientists_create_nanoscrolls_for_nextgen/,"['crafting nanoscrolls using janus nanosheets', 'tokyo scientists create nanoscrolls', 'innovation unlocks doors', 'researchers achieved', 'major breakthrough', 'gen tech', 'exciting possibilities', 'clean energy', 'optics', 'next', 'catalysis']"
1apefk7,"Deep Space Station 13 at NASA’s Goldstone complex in California – part of the agency’s Deep Space Network – is an experimental antenna that has been retrofitted with an optical terminal. In a first, this proof of concept received both radio frequency & laser signals from deep space at the same time.",2024-02-16T21:30:26.446000+0000,https://www.reddit.com/r/tech/comments/1apefk7/deep_space_station_13_at_nasas_goldstone_complex/,"['deep space station 13', 'deep space network –', 'california – part', 'deep space', 'radio frequency', 'optical terminal', 'nasa ’', 'laser signals', 'goldstone complex', 'experimental antenna', 'concept received', 'agency ’', 'time', 'retrofitted', 'proof', 'first']"
1ao9qkg,'A mouse for your mouth': New device allows users to scroll with their tongues,2024-02-12T15:20:17.802000+0000,https://www.reddit.com/r/tech/comments/1ao9qkg/a_mouse_for_your_mouth_new_device_allows_users_to/,"[""mouth ': new device allows users"", 'tongues', 'scroll', 'mouse']"
1anikxm,"This ultrasound sticker senses changing stiffness of deep internal organs. The sticky, wearable sensor could help identify early signs of acute liver failure.",2024-02-12T02:14:12.599000+0000,https://www.reddit.com/r/tech/comments/1anikxm/this_ultrasound_sticker_senses_changing_stiffness/,"['wearable sensor could help identify early signs', 'ultrasound sticker senses changing stiffness', 'deep internal organs', 'acute liver failure', 'sticky']"
1amwuof,"In a First, a Prosthetic Limb Can Sense Temperature Like a Living Hand",2024-02-12T23:27:16.177000+0000,https://www.reddit.com/r/tech/comments/1amwuof/in_a_first_a_prosthetic_limb_can_sense/,"['sense temperature like', 'prosthetic limb', 'living hand', 'first']"
1amwhcv,Alternate qubit design does error correction in hardware. Early-stage technology has the potential to cut qubits needed for useful computers.,2024-02-11T14:55:20.790000+0000,https://www.reddit.com/r/tech/comments/1amwhcv/alternate_qubit_design_does_error_correction_in/,"['cut qubits needed', 'alternate qubit design', 'useful computers', 'stage technology', 'error correction', 'potential', 'hardware', 'early']"
1an27ye,Scientists develop a low-cost device to make cell therapy safer | A plastic microfluidic chip can remove some risky cells that could potentially become tumors before they are implanted in a patient.,2024-02-10T15:19:21.554000+0000,https://www.reddit.com/r/tech/comments/1an27ye/scientists_develop_a_lowcost_device_to_make_cell/,"['make cell therapy safer', 'could potentially become tumors', 'plastic microfluidic chip', 'scientists develop', 'risky cells', 'cost device', 'remove', 'patient', 'low', 'implanted']"
1ambhi8,"Gel and lithium-ion tech could enable 1000-mile EV range on one charge | Researchers achieve EV battery breakthrough with silicon-based materials and gel electrolytes, moving closer to a 1,000-kilometer range on a single charge.",2024-02-09T19:49:25.474000+0000,https://www.reddit.com/r/tech/comments/1ambhi8/gel_and_lithiumion_tech_could_enable_1000mile_ev/,"['ion tech could enable 1000', 'researchers achieve ev battery breakthrough', 'mile ev range', 'kilometer range', 'single charge', 'one charge', 'moving closer', 'based materials', 'gel electrolytes', 'gel', 'silicon', 'lithium', '1', '000']"
1alxzqy,Inhalable sensors could enable early lung cancer detection,2024-02-09T19:33:12.880000+0000,https://www.reddit.com/r/tech/comments/1alxzqy/inhalable_sensors_could_enable_early_lung_cancer/,['inhalable sensors could enable early lung cancer detection']
1altk5w,AI can now master your music—and it does shockingly well,2024-02-09T23:42:28.390000+0000,https://www.reddit.com/r/tech/comments/1altk5w/ai_can_now_master_your_musicand_it_does/,"['shockingly well', 'music —', 'master', 'ai']"
1alklva,CERN unleashes powerful robot-dog to inspect nuclear radiation zones,2024-01-23T15:43:10.795000+0000,https://www.reddit.com/r/tech/comments/1alklva/cern_unleashes_powerful_robotdog_to_inspect/,"['inspect nuclear radiation zones', 'cern unleashes powerful robot', 'dog']"
1al0z0l,Sugar cane waste converted into concrete-beating Sugarcrete | Substance has been incorporated into an eco-friendly building material,2024-02-09T00:57:15.446000+0000,https://www.reddit.com/r/tech/comments/1al0z0l/sugar_cane_waste_converted_into_concretebeating/,"['sugar cane waste converted', 'friendly building material', 'beating sugarcrete', 'substance', 'incorporated', 'eco', 'concrete']"
1alyut1,"Momentary Fusion Breakthroughs Face Hard Reality. New NIF data yields promise, though road to repeatability remains long.",2024-02-08T15:16:25.777000+0000,https://www.reddit.com/r/tech/comments/1alyut1/momentary_fusion_breakthroughs_face_hard_reality/,"['momentary fusion breakthroughs face hard reality', 'new nif data yields promise', 'repeatability remains long', 'though road']"
1al62mj,Researchers have developed a new method to extract high-quality iron using hydrogen plasma-based reduction to turn toxic red mud into iron that is pure enough for steelmaking.,2024-02-08T11:25:16.893000+0000,https://www.reddit.com/r/tech/comments/1al62mj/researchers_have_developed_a_new_method_to/,"['quality iron using hydrogen plasma', 'turn toxic red mud', 'pure enough', 'new method', 'extract high', 'based reduction', 'iron', 'steelmaking', 'researchers', 'developed']"
1akbgkc,"Korean researchers develop heat-resistant material that withstands 1000°C/1832°F | Not just high temperatures, the material also works well under extreme UV exposure making it ideal for applications in space too.",2024-02-08T02:12:46.934000+0000,https://www.reddit.com/r/tech/comments/1akbgkc/korean_researchers_develop_heatresistant_material/,"['korean researchers develop heat', 'extreme uv exposure making', 'withstands 1000 ° c', 'material also works well', '1832 ° f', 'resistant material', 'high temperatures', 'space', 'ideal', 'applications']"
1ak9pxq,AiSee wearable tells blind users what they're holding in their hand,2024-02-07T11:38:06.714000+0000,https://www.reddit.com/r/tech/comments/1ak9pxq/aisee_wearable_tells_blind_users_what_theyre/,"['aisee wearable tells blind users', 'holding', 'hand']"
1ajflwy,Experimental gene therapy allows kids with inherited deafness to hear,2024-02-08T15:54:58.764000+0000,https://www.reddit.com/r/tech/comments/1ajflwy/experimental_gene_therapy_allows_kids_with/,"['experimental gene therapy allows kids', 'inherited deafness', 'hear']"
1ajkgzg,"US firm plans to build 10,000 qubit quantum computer by 2026 | The first fault-tolerant quantum computer could be unveiled before the year end, marking an important milestone in the field.",2024-02-07T15:53:07.864000+0000,https://www.reddit.com/r/tech/comments/1ajkgzg/us_firm_plans_to_build_10000_qubit_quantum/,"['tolerant quantum computer could', '000 qubit quantum computer', 'us firm plans', 'year end', 'important milestone', 'first fault', 'build 10', 'unveiled', 'marking', 'field', '2026']"
1ajdrfo,This new piezoelectric bandage can heal broken bones faster | The future of bone healing could feature 'bone bandages' that harness piezoelectricity and natural minerals.,2024-02-06T14:48:12.279000+0000,https://www.reddit.com/r/tech/comments/1ajdrfo/this_new_piezoelectric_bandage_can_heal_broken/,"['heal broken bones faster', 'bone healing could feature', 'new piezoelectric bandage', 'bone bandages', 'natural minerals', 'harness piezoelectricity', 'future']"
1aincfc,This biodegradable sensor can tell if your food is safe from pesticides | The device could help ensure food safety in a world that faces food scarcity and health issues due to the excessive use of agrochemicals.,2024-01-23T15:43:10.795000+0000,https://www.reddit.com/r/tech/comments/1aincfc/this_biodegradable_sensor_can_tell_if_your_food/,"['device could help ensure food safety', 'faces food scarcity', 'health issues due', 'excessive use', 'biodegradable sensor', 'food', 'world', 'tell', 'safe', 'pesticides', 'agrochemicals']"
1ahxz80,NASA’s Next-Generation ISS Spacesuit Passes Zero-Gravity Test,2024-02-06T13:27:07.591000+0000,https://www.reddit.com/r/tech/comments/1ahxz80/nasas_nextgeneration_iss_spacesuit_passes/,"['generation iss spacesuit passes zero', 'nasa ’', 'gravity test', 'next']"
1ah4o2o,First functional human brain tissue produced through 3D printing | A team of researchers has created functional 3D-printed brain tissue to examine the brain's function and study various neurological disorders.,2024-02-05T12:43:22.621000+0000,https://www.reddit.com/r/tech/comments/1ah4o2o/first_functional_human_brain_tissue_produced/,"['first functional human brain tissue produced', 'study various neurological disorders', 'printed brain tissue', 'created functional 3d', '3d printing', 'brain', 'team', 'researchers', 'function', 'examine']"
1ah2i1c,"Nanoparticle Skin Patch Monitors Tumor Size During Cancer Care | The nanoparticle-infused skin patch can send its data to a smartphone, making tumor monitoring even easier.",2024-02-05T16:24:11.990000+0000,https://www.reddit.com/r/tech/comments/1ah2i1c/nanoparticle_skin_patch_monitors_tumor_size/,"['nanoparticle skin patch monitors tumor size', 'making tumor monitoring even easier', 'infused skin patch', 'cancer care', 'nanoparticle', 'smartphone', 'send', 'data']"
1ah2956,Infrared Sensors Can Now Peer Around Corners | Non-line-of-sight imaging is no longer restricted to visible wavelengths of light,2024-02-05T10:51:54.153000+0000,https://www.reddit.com/r/tech/comments/1ah2956/infrared_sensors_can_now_peer_around_corners/,"['peer around corners', 'visible wavelengths', 'sight imaging', 'longer restricted', 'infrared sensors', 'non', 'line', 'light']"
1agnias,Imaging method reveals new cells and structures in human brain tissue. A new microscopy technique that enables high-resolution imaging could one day help doctors diagnose and treat brain tumors.,2024-02-04T12:59:13.110000+0000,https://www.reddit.com/r/tech/comments/1agnias/imaging_method_reveals_new_cells_and_structures/,"['resolution imaging could one day help doctors diagnose', 'imaging method reveals new cells', 'new microscopy technique', 'treat brain tumors', 'human brain tissue', 'enables high', 'structures']"
1agetuk,The European Space Agency will test 3D printing metal on the ISS,2024-02-03T15:00:22.894000+0000,https://www.reddit.com/r/tech/comments/1agetuk/the_european_space_agency_will_test_3d_printing/,"['test 3d printing metal', 'european space agency', 'iss']"
1agghs3,"HaLow Wi-Fi standard achieves 1.8-mile range in field test | Ultra-long range could support public Wi-Fi, IoT, smart buildings, and more",2024-02-02T14:15:51.447000+0000,https://www.reddit.com/r/tech/comments/1agghs3/halow_wifi_standard_achieves_18mile_range_in/,"['long range could support public wi', 'fi standard achieves 1', 'mile range', 'halow wi', 'smart buildings', 'field test', 'fi', 'ultra', 'iot', '8']"
1agcqw8,Can a Brain Implant Treat Addiction? Some experts tout deep brain stimulation as a lifeline for people struggling with opioid use. Others question the hype.,2024-02-02T12:26:41.736000+0000,https://www.reddit.com/r/tech/comments/1agcqw8/can_a_brain_implant_treat_addiction_some_experts/,"['experts tout deep brain stimulation', 'brain implant treat addiction', 'people struggling', 'others question', 'opioid use', 'lifeline', 'hype']"
1agdn18,"NASA's RST next-gen imaging tech lets experts directly view exoplanets | NASA's Roman Space Telescope, featuring the novel Coronagraph Instrument, is set to transform exoplanet imaging, pushing the boundaries of space exploration.",2024-01-22T19:51:08.415000+0000,https://www.reddit.com/r/tech/comments/1agdn18/nasas_rst_nextgen_imaging_tech_lets_experts/,"['gen imaging tech lets experts directly view exoplanets', 'transform exoplanet imaging', 'novel coronagraph instrument', 'roman space telescope', 'space exploration', 'rst next', 'set', 'pushing', 'nasa', 'nasa', 'featuring', 'boundaries']"
1afjsxn,"How bacteria and self-healing roads could soon fix the UK’s 750,000 potholes",2024-02-02T12:12:07.803000+0000,https://www.reddit.com/r/tech/comments/1afjsxn/how_bacteria_and_selfhealing_roads_could_soon_fix/,"['healing roads could soon fix', 'uk ’', '000 potholes', 'self', 'bacteria', '750']"
1afkz22,"Phone vibration motor used to build 3D tumor model for cancer drug testing | Researchers pioneer a $7 DIY device, using a cell phone motor, for high-throughput 3D tumor spheroid creation, revolutionizing anti-cancer drug testing.",2024-02-01T22:24:43.389000+0000,https://www.reddit.com/r/tech/comments/1afkz22/phone_vibration_motor_used_to_build_3d_tumor/,"['throughput 3d tumor spheroid creation', 'build 3d tumor model', 'phone vibration motor used', 'cell phone motor', 'cancer drug testing', 'cancer drug testing', '7 diy device', 'revolutionizing anti', 'researchers pioneer', 'using', 'high']"
1afkx0i,"WaveAerospace has announced ""the world's fastest multirotor UAS,"" a ""new class of aircraft"" | A quadcopter drone with a 300+ mph jet turbine in the middle, capable of all-weather operation.",2024-02-01T16:21:56.708000+0000,https://www.reddit.com/r/tech/comments/1afkx0i/waveaerospace_has_announced_the_worlds_fastest/,"['fastest multirotor uas ,""', 'mph jet turbine', 'weather operation', 'quadcopter drone', 'new class', 'world', 'waveaerospace', 'middle', 'capable', 'announced', 'aircraft', '300']"
1afi56c,"The New, New Transistor. In power electronics, aluminum nitride could overtake two powerhouses that only recently bested silicon.",2024-02-01T17:30:58.401000+0000,https://www.reddit.com/r/tech/comments/1afi56c/the_new_new_transistor_in_power_electronics/,"['aluminum nitride could overtake two powerhouses', 'recently bested silicon', 'power electronics', 'new transistor', 'new']"
1af9joc,DNA particles that mimic viruses hold promise as vaccines,2024-02-01T14:51:04.478000+0000,https://www.reddit.com/r/tech/comments/1af9joc/dna_particles_that_mimic_viruses_hold_promise_as/,"['mimic viruses hold promise', 'dna particles', 'vaccines']"
1aeq46d,"RTX CHIMERA new microwave fries drone target during White Sands testing | Throughout a three-week field test, Raytheon's CHIMERA high-powered microwave system managed to fry static targets and track aerial targets flawlessly.",2024-02-01T15:30:42.277000+0000,https://www.reddit.com/r/tech/comments/1aeq46d/rtx_chimera_new_microwave_fries_drone_target/,"['rtx chimera new microwave fries drone target', 'powered microwave system managed', 'track aerial targets flawlessly', 'fry static targets', 'white sands testing', 'week field test', 'chimera high', 'throughout', 'three', 'raytheon']"
1aemspz,"Researchers developed a battery-free sensor that reacts to sound waves, producing vibrational energy to power an electronic device | The novel sensor would not only reduce battery waste but could also power medical devices like cochlear implants or monitor buildings for faults.",2024-01-31T15:01:31.976000+0000,https://www.reddit.com/r/tech/comments/1aemspz/researchers_developed_a_batteryfree_sensor_that/,"['could also power medical devices like cochlear implants', 'producing vibrational energy', 'novel sensor would', 'reduce battery waste', 'power', 'free sensor', 'sound waves', 'researchers developed', 'monitor buildings', 'electronic device', 'battery', 'reacts', 'faults']"
1adtsmi,"A breakthrough clinical trial using gene therapy has restored hearing to five children born deaf | After six months, the children were able to recognize speech and hold conversations, raising hopes for wider use in the near future.",2024-01-31T15:52:32.967000+0000,https://www.reddit.com/r/tech/comments/1adtsmi/a_breakthrough_clinical_trial_using_gene_therapy/,"['breakthrough clinical trial using gene therapy', 'five children born deaf', 'wider use', 'six months', 'restored hearing', 'recognize speech', 'raising hopes', 'near future', 'hold conversations', 'children', 'able']"
1adyjut,It turns out NASA’s Mars helicopter was much more revolutionary than we knew | Ingenuity packed more computing power than all other NASA deep space missions combined.,2024-01-04T14:49:58.179000+0000,https://www.reddit.com/r/tech/comments/1adyjut/it_turns_out_nasas_mars_helicopter_was_much_more/,"['nasa deep space missions combined', 'nasa ’', 'mars helicopter', 'ingenuity packed', 'computing power', 'turns', 'revolutionary', 'much', 'knew']"
1adtlc2,"China creates atomic clock that will run error-free for 7.2 billion years | Using strontium and ultra-stable lasers, the researchers have built an optical clock, the second of its kind in the world.",2024-01-31T15:50:13.501000+0000,https://www.reddit.com/r/tech/comments/1adtlc2/china_creates_atomic_clock_that_will_run/,"['china creates atomic clock', '2 billion years', 'optical clock', 'using strontium', 'stable lasers', 'run error', 'world', 'ultra', 'second', 'researchers', 'kind', 'free', 'built', '7']"
1ad5kow,"DNA From the Ocean’s ‘Twilight Zone’ Could Lead to New Lifesaving Drugs, Scientists Say. Researchers catalogued the genes of more than 300 million groups of marine bacteria, viruses and fungi in hopes that the database could lead to breakthroughs in medicine, energy and agriculture.",2024-01-31T13:43:26.627000+0000,https://www.reddit.com/r/tech/comments/1ad5kow/dna_from_the_oceans_twilight_zone_could_lead_to/,"['‘ twilight zone ’ could lead', 'database could lead', 'new lifesaving drugs', '300 million groups', 'ocean ’', 'scientists say', 'researchers catalogued', 'marine bacteria', 'viruses', 'medicine', 'hopes', 'genes', 'fungi', 'energy', 'dna', 'breakthroughs', 'agriculture']"
